{
  "generated_at": "2026-07-22T13:14:47",
  "today": "2026-07-22",
  "count": 13,
  "queue_count": 5,
  "non_empty_queue_count": 3,
  "queued_paper_total": 23,
  "severity_counts": {
    "high": 1,
    "medium": 2
  },
  "preset_counts": {
    "code_check": 1,
    "manual": 1,
    "schedule_review": 1
  },
  "queues": [
    {
      "id": "missing-taxonomy",
      "label": "缺分类",
      "severity": "high",
      "preset": "",
      "description": "缺 domain、topic 或 method 的论文，适合先补 frontmatter 分类。",
      "recommended_fields": [
        "domains",
        "topics",
        "methods"
      ],
      "count": 3,
      "share": 0.2308,
      "view_state": {
        "sort": "updated"
      },
      "href": "library.html?sort=updated",
      "slugs": [
        "2512.23424-akg-kernel-agent-multi",
        "2603.03251-speculative-speculative-decoding",
        "semantic-search-evaluation"
      ],
      "sample_papers": [
        {
          "slug": "2512.23424-akg-kernel-agent-multi",
          "title": "AKG kernel Agent: A Multi-Agent Framework for Cross-Platform Kernel Synthesis",
          "title_zh": "AKG kernel Agent：用于跨平台 Kernel 合成的多智能体框架",
          "href": "2512.23424-akg-kernel-agent-multi.html"
        },
        {
          "slug": "2603.03251-speculative-speculative-decoding",
          "title": "Speculative Speculative Decoding",
          "title_zh": "推测性推测解码",
          "href": "2603.03251-speculative-speculative-decoding.html"
        },
        {
          "slug": "semantic-search-evaluation",
          "title": "Semantic Search Evaluation",
          "title_zh": "Semantic Search Evaluation",
          "href": "semantic-search-evaluation.md"
        }
      ]
    },
    {
      "id": "missing-review-plan",
      "label": "缺复习计划",
      "severity": "medium",
      "preset": "schedule_review",
      "description": "没有 next_review 的论文，适合批量安排复习日期。",
      "recommended_fields": [
        "review_stage",
        "next_review"
      ],
      "count": 13,
      "share": 1.0,
      "view_state": {
        "review": "none",
        "sort": "importance"
      },
      "href": "library.html?review=none&sort=importance",
      "slugs": [
        "2307.08691-flashattention-2",
        "2604.11035-introspective-dlm",
        "2512.23424-akg-kernel-agent-multi",
        "2602.06036-dflash",
        "noarxiv-2026-dspark",
        "2503.01840-eagle-3-scaling-up",
        "2607.00466-eldr",
        "2501.01005-flashinfer",
        "2503.14075-twigvlm-plus-plus",
        "2605.12825-orthrus",
        "2603.03251-speculative-speculative-decoding",
        "2507.11851-llm-future-mtp",
        "semantic-search-evaluation"
      ],
      "sample_papers": [
        {
          "slug": "2307.08691-flashattention-2",
          "title": "FlashAttention-2: Faster Attention with Better Parallelism and Work Partitioning",
          "title_zh": "FlashAttention-2：用更好的并行性与工作划分加速 Attention",
          "href": "2307.08691-flashattention-2.html"
        },
        {
          "slug": "2604.11035-introspective-dlm",
          "title": "Introspective Diffusion Language Models",
          "title_zh": "内省式扩散语言模型",
          "href": "2604.11035-introspective-dlm.html"
        },
        {
          "slug": "2512.23424-akg-kernel-agent-multi",
          "title": "AKG kernel Agent: A Multi-Agent Framework for Cross-Platform Kernel Synthesis",
          "title_zh": "AKG kernel Agent：用于跨平台 Kernel 合成的多智能体框架",
          "href": "2512.23424-akg-kernel-agent-multi.html"
        },
        {
          "slug": "2602.06036-dflash",
          "title": "DFlash: Block Diffusion for Flash Speculative Decoding",
          "title_zh": "DFlash：用于快速 speculative decoding 的块扩散方法",
          "href": "2602.06036-dflash.html"
        },
        {
          "slug": "noarxiv-2026-dspark",
          "title": "DSpark: Confidence-Scheduled Speculative Decoding with Semi-Autoregressive Generation",
          "title_zh": "DSpark：基于置信度调度的半自回归 speculative decoding",
          "href": "noarxiv-2026-dspark.html"
        },
        {
          "slug": "2503.01840-eagle-3-scaling-up",
          "title": "EAGLE-3: Scaling up Inference Acceleration of Large Language Models via Training-Time Test",
          "title_zh": "EAGLE-3：通过训练时测试扩展大语言模型推理加速",
          "href": "2503.01840-eagle-3-scaling-up.html"
        },
        {
          "slug": "2607.00466-eldr",
          "title": "ELDR: Expert-Locality-Aware Decode Routing for PD-Disaggregated MoE Serving",
          "title_zh": "ELDR：面向 PD 分离 MoE 服务的专家局部性感知解码路由",
          "href": "2607.00466-eldr.html"
        },
        {
          "slug": "2501.01005-flashinfer",
          "title": "FlashInfer: Efficient and Customizable Attention Engine for LLM Inference Serving",
          "title_zh": "FlashInfer：面向 LLM 推理服务的高效可定制 Attention 引擎",
          "href": "2501.01005-flashinfer.html"
        }
      ]
    },
    {
      "id": "due-review",
      "label": "到期复习",
      "severity": "high",
      "preset": "schedule_review",
      "description": "next_review 已到期的论文，适合立即进入复习队列。",
      "recommended_fields": [
        "review_stage",
        "next_review"
      ],
      "count": 0,
      "share": 0.0,
      "view_state": {
        "review": "due",
        "sort": "importance"
      },
      "href": "library.html?review=due&sort=importance",
      "slugs": [],
      "sample_papers": []
    },
    {
      "id": "code-unchecked",
      "label": "有代码未检查",
      "severity": "medium",
      "preset": "code_check",
      "description": "已标记有代码但阅读阶段还不是 code_checked 的论文。",
      "recommended_fields": [
        "reading_stage",
        "review_stage",
        "next_review"
      ],
      "count": 7,
      "share": 0.5385,
      "view_state": {
        "code": "yes",
        "sort": "importance"
      },
      "href": "library.html?code=yes&sort=importance",
      "slugs": [
        "2307.08691-flashattention-2",
        "2604.11035-introspective-dlm",
        "2602.06036-dflash",
        "2503.01840-eagle-3-scaling-up",
        "2501.01005-flashinfer",
        "2605.12825-orthrus",
        "2603.03251-speculative-speculative-decoding"
      ],
      "sample_papers": [
        {
          "slug": "2307.08691-flashattention-2",
          "title": "FlashAttention-2: Faster Attention with Better Parallelism and Work Partitioning",
          "title_zh": "FlashAttention-2：用更好的并行性与工作划分加速 Attention",
          "href": "2307.08691-flashattention-2.html"
        },
        {
          "slug": "2604.11035-introspective-dlm",
          "title": "Introspective Diffusion Language Models",
          "title_zh": "内省式扩散语言模型",
          "href": "2604.11035-introspective-dlm.html"
        },
        {
          "slug": "2602.06036-dflash",
          "title": "DFlash: Block Diffusion for Flash Speculative Decoding",
          "title_zh": "DFlash：用于快速 speculative decoding 的块扩散方法",
          "href": "2602.06036-dflash.html"
        },
        {
          "slug": "2503.01840-eagle-3-scaling-up",
          "title": "EAGLE-3: Scaling up Inference Acceleration of Large Language Models via Training-Time Test",
          "title_zh": "EAGLE-3：通过训练时测试扩展大语言模型推理加速",
          "href": "2503.01840-eagle-3-scaling-up.html"
        },
        {
          "slug": "2501.01005-flashinfer",
          "title": "FlashInfer: Efficient and Customizable Attention Engine for LLM Inference Serving",
          "title_zh": "FlashInfer：面向 LLM 推理服务的高效可定制 Attention 引擎",
          "href": "2501.01005-flashinfer.html"
        },
        {
          "slug": "2605.12825-orthrus",
          "title": "Orthrus: Memory-Efficient Parallel Token Generation via Dual-View Diffusion",
          "title_zh": "Orthrus：通过双视角扩散实现内存高效的并行 token 生成",
          "href": "2605.12825-orthrus.html"
        },
        {
          "slug": "2603.03251-speculative-speculative-decoding",
          "title": "Speculative Speculative Decoding",
          "title_zh": "推测性推测解码",
          "href": "2603.03251-speculative-speculative-decoding.html"
        }
      ]
    },
    {
      "id": "high-priority-unread",
      "label": "高优先级待读",
      "severity": "high",
      "preset": "deep_read",
      "description": "重要性不低于 4 且仍处在未读、排队或分流状态的核心论文。",
      "recommended_fields": [
        "status",
        "reading_stage",
        "next_review"
      ],
      "count": 0,
      "share": 0.0,
      "view_state": {
        "importance": "4",
        "sort": "importance"
      },
      "href": "library.html?importance=4&sort=importance",
      "slugs": [],
      "sample_papers": []
    }
  ],
  "top_queues": [
    {
      "id": "missing-review-plan",
      "label": "缺复习计划",
      "severity": "medium",
      "preset": "schedule_review",
      "description": "没有 next_review 的论文，适合批量安排复习日期。",
      "recommended_fields": [
        "review_stage",
        "next_review"
      ],
      "count": 13,
      "share": 1.0,
      "view_state": {
        "review": "none",
        "sort": "importance"
      },
      "href": "library.html?review=none&sort=importance",
      "slugs": [
        "2307.08691-flashattention-2",
        "2604.11035-introspective-dlm",
        "2512.23424-akg-kernel-agent-multi",
        "2602.06036-dflash",
        "noarxiv-2026-dspark",
        "2503.01840-eagle-3-scaling-up",
        "2607.00466-eldr",
        "2501.01005-flashinfer",
        "2503.14075-twigvlm-plus-plus",
        "2605.12825-orthrus",
        "2603.03251-speculative-speculative-decoding",
        "2507.11851-llm-future-mtp",
        "semantic-search-evaluation"
      ],
      "sample_papers": [
        {
          "slug": "2307.08691-flashattention-2",
          "title": "FlashAttention-2: Faster Attention with Better Parallelism and Work Partitioning",
          "title_zh": "FlashAttention-2：用更好的并行性与工作划分加速 Attention",
          "href": "2307.08691-flashattention-2.html"
        },
        {
          "slug": "2604.11035-introspective-dlm",
          "title": "Introspective Diffusion Language Models",
          "title_zh": "内省式扩散语言模型",